Title,URL,Description,Details,Journal,Year,Resource,Type,Identifiers,Db,EntrezUID,cDate,First_Author,University,Author_Number,pmid
Larvicidal activity of some plant extracts to larvae of the mosquito Culex quinquefasciatus (Say 1823).,/pubmed/21284341,"Ali NO, El-Rabaa FM.",Eur Rev Med Pharmacol Sci. 2010 Nov;14(11):925-33.,Eur Rev Med Pharmacol Sci, 2010,PubMed,citation,PMID:21284341,pubmed,21284341,2011/02/03 , Ali NO,Khartoum,2,21284341
Assessment of qualitative changes of Acid mucins among sudanese colorectal carcinoma patients.,/pubmed/21264528,"Zakout YM, Ezeldeen YA.",J Gastrointest Cancer. 2012 Jun;43(2):205-8. doi: 10.1007/s12029-010-9246-9.,J Gastrointest Cancer, 2012,PubMed,citation,PMID:21264528,pubmed,21264528,2011/01/26 , Zakout YM,Khartoum,2,21264528
The safety and efficacy of itraconazole for the treatment of patients with eumycetoma due to Madurella mycetomatis.,/pubmed/21247608,"Fahal AH, Rahman IA, El-Hassan AM, Rahman ME, Zijlstra EE.",Trans R Soc Trop Med Hyg. 2011 Mar;105(3):127-32. doi: 10.1016/j.trstmh.2010.11.008.,Trans R Soc Trop Med Hyg, 2011,PubMed,citation,PMID:21247608,pubmed,21247608,2011/01/21 , Fahal AH,Khartoum,5,21247608
Epidemiology of urinary tract infections and antibiotics sensitivity among pregnant women at Khartoum North Hospital.,/pubmed/21244660,"Hamdan HZ, Ziad AH, Ali SK, Adam I.",Ann Clin Microbiol Antimicrob. 2011 Jan 18;10:2. doi: 10.1186/1476-0711-10-2.,Ann Clin Microbiol Antimicrob, 2011,PubMed,citation,PMID:21244660 | PMCID:PMC3032644,pubmed,21244660,2011/01/20 , Hamdan HZ,Khartoum,4,21244660 | PMCID:PMC3032644
Frequency of Candida species in Papanicolaou smears taken from Sudanese oral hormonal contraceptives users.,/pubmed/21235288,"Zakout YM, Salih MM, Ahmed HG.",Biotech Histochem. 2012 Feb;87(2):95-7. doi: 10.3109/10520295.2010.548833.,Biotech Histochem, 2012,PubMed,citation,PMID:21235288,pubmed,21235288,2011/01/18 , Zakout YM,Khartoum,3,21235288
High Rate of Obesity-Associated Hypertension among Primary Schoolchildren in Sudan.,/pubmed/21234364,"Salman Z, Kirk GD, Deboer MD.",Int J Hypertens. 2010 Dec 22;2011:629492. doi: 10.4061/2011/629492.,Int J Hypertens, 2010,PubMed,citation,PMID:21234364 | PMCID:PMC3014717,pubmed,21234364,2011/01/15 , Salman Z,Khartoum,3,21234364 | PMCID:PMC3014717
The treatment of relapse in adults with minimal change nephrotic syndrome: myths and facts.,/pubmed/21196608,Shigidi MM.,Saudi J Kidney Dis Transpl. 2011 Jan;22(1):10-7. Review.,Saudi J Kidney Dis Transpl, 2011,PubMed,citation,PMID:21196608,pubmed,21196608,2011/01/05 , Shigidi MM,Khartoum,1,21196608
Genotypes of human papilloma virus in Sudanese women with cervical pathology.,/pubmed/21192803,"Salih MM, Safi ME, Hart K, Tobi K, Adam I.",Infect Agent Cancer. 2010 Dec 30;5:26. doi: 10.1186/1750-9378-5-26.,Infect Agent Cancer, 2010,PubMed,citation,PMID:21192803 | PMCID:PMC3022610,pubmed,21192803,2011/01/05 , Salih MM,Khartoum,5,21192803 | PMCID:PMC3022610
Button battery induced traumatic tracheoesophageal fistula: Case report and review of literature.,/pubmed/27493318,"Abdulkareem I, Sabir OM, Elamin A.",Sudan J Paediatr. 2011;11(2):43-9.,Sudan J Paediatr, 2011,PubMed,citation,PMID:27493318 | PMCID:PMC4949834,pubmed,27493318,2011/01/01 , Abdulkareem I,Khartoum,3,27493318 | PMCID:PMC4949834
Infection and immunoglobulin levels in Sudanese children with severe protein-energy malnutrition.,/pubmed/27493317,"Suliman OS, Salih MA, Karrar ZA, Mohammed AO, Helsing C.",Sudan J Paediatr. 2011;11(2):32-42.,Sudan J Paediatr, 2011,PubMed,citation,PMID:27493317 | PMCID:PMC4949832,pubmed,27493317,2011/01/01 , Suliman OS,Khartoum,5,27493317 | PMCID:PMC4949832
"Characteristics associated with severe pneumonia in under-five children admitted to emergency units of two teaching hospitals in Khartoum, Sudan.",/pubmed/27493316,"Salih KE, Salih A, El Samani el FZ, Hussien KE, Ibrahim SA.",Sudan J Paediatr. 2011;11(2):25-31.,Sudan J Paediatr, 2011,PubMed,citation,PMID:27493316 | PMCID:PMC4949831,pubmed,27493316,2011/01/01 , Salih KE,Khartoum,5,27493316 | PMCID:PMC4949831
Acute phase reactants in Sudanese children with severe protein-energy malnutrition.,/pubmed/27493306,"Suliman OS, Salih MA, Karrar ZA, Mohammed AO, Helsing C.",Sudan J Paediatr. 2011;11(1):48-59.,Sudan J Paediatr, 2011,PubMed,citation,PMID:27493306 | PMCID:PMC4949782,pubmed,27493306,2011/01/01 , Suliman OS,Khartoum,5,27493306 | PMCID:PMC4949782
Sanjad-Sakati Syndrome in Sudanese children.,/pubmed/27493305,"Arabi WA, Basheer AA, Abdullah MA.",Sudan J Paediatr. 2011;11(1):42-7.,Sudan J Paediatr, 2011,PubMed,citation,PMID:27493305 | PMCID:PMC4949781,pubmed,27493305,2011/01/01 , Arabi WA,Khartoum,3,27493305 | PMCID:PMC4949781
Pathologic causes of liver disease in Sudanese children: Results of 450 liver needle biopsies at a single children hospital.,/pubmed/27493304,Sabir OM.,Sudan J Paediatr. 2011;11(1):38-41.,Sudan J Paediatr, 2011,PubMed,citation,PMID:27493304 | PMCID:PMC4949779,pubmed,27493304,2011/01/01 , Sabir OM,Khartoum,1,27493304 | PMCID:PMC4949779
Recent intrauterine growth parameters of term Sudanese neonates in Khartoum compared to the findings three decades earlier.,/pubmed/27493303,"Abdel Rahman SE, Ibrahim GO.",Sudan J Paediatr. 2011;11(1):29-37.,Sudan J Paediatr, 2011,PubMed,citation,PMID:27493303 | PMCID:PMC4949778,pubmed,27493303,2011/01/01 , Abdel Rahman SE,Khartoum,2,27493303 | PMCID:PMC4949778
The role of the health system in the prevention of hearing loss among children in Sub-Saharan Africa.,/pubmed/27493301,"Abdalla FM, Omar MA.",Sudan J Paediatr. 2011;11(1):8-19. Review.,Sudan J Paediatr, 2011,PubMed,citation,PMID:27493301 | PMCID:PMC4949789,pubmed,27493301,2011/01/01 , Abdalla FM,Khartoum,2,27493301 | PMCID:PMC4949789
"Nasopharyngeal cancer in Sudan: epidemiology, clinical and histological characteristics.",/pubmed/24179400,"Abdullah NE, Adam AA, Khalifa EH, El Hassan LA, Ibrahim ME, Hamad KM, El Hassan AM.",Clin Med Insights Ear Nose Throat. 2011 Feb 22;4:5-11. doi: 10.4137/CMENT.S5825.,Clin Med Insights Ear Nose Throat, 2011,PubMed,citation,PMID:24179400 | PMCID:PMC3783288,pubmed,24179400,2011/01/01 , Abdullah NE,Khartoum,7,24179400 | PMCID:PMC3783288
Performance evaluation of three different types of local evaporative cooling pads in greenhouses in Sudan.,/pubmed/23961103,"Ahmed EM, Abaas O, Ahmed M, Ismail MR.",Saudi J Biol Sci. 2011 Jan;18(1):45-51. doi: 10.1016/j.sjbs.2010.09.005.,Saudi J Biol Sci, 2011,PubMed,citation,PMID:23961103 | PMCID:PMC3730861,pubmed,23961103,2011/01/01 , Ahmed EM,Khartoum,4,23961103 | PMCID:PMC3730861
Acceptable alternatives for forced vital capacity in the spirometric diagnosis of bronchial asthma.,/pubmed/23776767,Lutfi MF.,Int J Appl Basic Med Res. 2011 Jan;1(1):20-3. doi: 10.4103/2229-516X.81975. Erratum in: Int J Appl Basic Med Res. 2012 Jan;2(1):62.,Int J Appl Basic Med Res, 2011,PubMed,citation,PMID:23776767 | PMCID:PMC3657951,pubmed,23776767,2011/01/01 , Lutfi MF,Khartoum,1,23776767 | PMCID:PMC3657951
Evaluation of oral health-related quality of life among Sudanese schoolchildren using Child-OIDP inventory.,/pubmed/21182769,"Nurelhuda NM, Ahmed MF, Trovik TA, Åstrøm AN.",Health Qual Life Outcomes. 2010 Dec 23;8:152. doi: 10.1186/1477-7525-8-152.,Health Qual Life Outcomes, 2010,PubMed,citation,PMID:21182769 | PMCID:PMC3019139,pubmed,21182769,2010/12/25 , Nurelhuda NM,Khartoum,4,21182769 | PMCID:PMC3019139
Title,URL,Description,Details,ShortDetails,NA,Resource,Type,Identifiers,Db,EntrezUID,Properties,NA,Khartoum,1,Identifiers
Fetal Doppler ultrasound assessment of ductus venosus in a 31-40 [corrected] weeks gestation normal fetus in the Pakistani population.,/pubmed/21173937,"Gilani SA, Javaid A, Bala AA.",Med Ultrason. 2010 Jun;12(2):110-3. Erratum in: Med Ultrason. 2010 Sep;12(3):260.,Med Ultrason, 2010,PubMed,citation,PMID:21173937,pubmed,21173937,2010/12/22 , Gilani SA,Khartoum,3,21173937
Empyema thoracis.,/pubmed/21157522,"Ahmed AE, Yacoub TE.",Clin Med Insights Circ Respir Pulm Med. 2010 Jun 17;4:1-8.,Clin Med Insights Circ Respir Pulm Med, 2010,PubMed,citation,PMID:21157522 | PMCID:PMC2998927,pubmed,21157522,2010/12/16 , Ahmed AE,Khartoum,2,21157522 | PMCID:PMC2998927
The potential of 4D sonography in the assessment of fetal behavior in high-risk pregnancies.,/pubmed/21142753,"Talic A, Kurjak A, Ahmed B, Stanojevic M, Predojevic M, Kadic AS, Di Renzo GC.",J Matern Fetal Neonatal Med. 2011 Jul;24(7):948-54. doi: 10.3109/14767058.2010.534830.,J Matern Fetal Neonatal Med, 2011,PubMed,citation,PMID:21142753,pubmed,21142753,2010/12/15 , Talic A,Khartoum,7,21142753
Raised plasma insulin level and homeostasis model assessment (HOMA) score in cerebral malaria: evidence for insulin resistance and marker of virulence.,/pubmed/21140005,"Eltahir EM, El Ghazali G, A-Elgadir TM, A-Elbasit IE, Elbashir MI, Giha HA.",Acta Biochim Pol. 2010;57(4):513-20.,Acta Biochim Pol, 2010,PubMed,citation,PMID:21140005,pubmed,21140005,2010/12/09 , Eltahir EM,Khartoum,6,21140005
Epidemiology of underweight and overweight-obesity among term pregnant Sudanese women.,/pubmed/21134264,"Rayis DA, Abbaker AO, Salih Y, Diab TE, Adam I.",BMC Res Notes. 2010 Dec 6;3:327. doi: 10.1186/1756-0500-3-327.,BMC Res Notes, 2010,PubMed,citation,PMID:21134264 | PMCID:PMC3004927,pubmed,21134264,2010/12/08 , Rayis DA,Khartoum,5,21134264 | PMCID:PMC3004927
"Drug use practices at pediatric hospitals of Khartoum State, Sudan.",/pubmed/21119094,"Ahmed AM, Awad AI.",Ann Pharmacother. 2010 Dec;44(12):1986-93. doi: 10.1345/aph.1P423.,Ann Pharmacother, 2010,PubMed,citation,PMID:21119094,pubmed,21119094,2010/12/02 , Ahmed AM,Khartoum,2,21119094
Cytokine profiles in children with severe Plasmodium falciparum malaria in an area of unstable malaria transmission in central Sudan.,/pubmed/21118871,"Mirghani HA, Eltahir HG, A-Elgadir TM, Mirghani YA, Elbashir MI, Adam I.",J Trop Pediatr. 2011 Oct;57(5):392-5. doi: 10.1093/tropej/fmq109.,J Trop Pediatr, 2011,PubMed,citation,PMID:21118871,pubmed,21118871,2010/12/02 , Mirghani HA,Khartoum,6,21118871
Mode of action of epoxyphomalins A and B and characterization of related metabolites from the marine-derived fungus Paraconiothyrium sp.,/pubmed/21114274,"Mohamed IE, Kehraus S, Krick A, König GM, Kelter G, Maier A, Fiebig HH, Kalesse M, Malek NP, Gross H.",J Nat Prod. 2010 Dec 27;73(12):2053-6. doi: 10.1021/np100310k.,J Nat Prod, 2010,PubMed,citation,PMID:21114274,pubmed,21114274,2010/12/01 , Mohamed IE,Khartoum,10,21114274
"Assessment of core activities and supportive functions for the communicable diseases surveillance system in Khartoum state, Sudan, 2005-2007.",/pubmed/24988392,"Sahal N, Reintjes R, Eltayeb EM, Aro AR.",East Mediterr Health J. 2012 Dec 4;16(12):1204-10.,East Mediterr Health J, 2012,PubMed,citation,PMID:24988392,pubmed,24988392,2010/12/01 , Sahal N,Khartoum,4,24988392
Aflatoxin B1 contamination of traditionally processed peanuts butter for human consumption in Sudan.,/pubmed/21104323,"Elshafie SZ, ElMubarak A, El-Nagerabi SA, Elshafie AE.",Mycopathologia. 2011 Jun;171(6):435-9. doi: 10.1007/s11046-010-9378-2.,Mycopathologia, 2011,PubMed,citation,PMID:21104323,pubmed,21104323,2010/11/26 , Elshafie SZ,Khartoum,4,21104323
"In areas of low transmission, is the presumptive treatment of febrile but bloodsmear-negative patients for malaria validated by the results of PCR-based testing?",/pubmed/21092394,"A-Elgayoum SM, El-Rayah EA, Giha HA.",Ann Trop Med Parasitol. 2010 Oct;104(7):573-81. doi: 10.1179/136485910X12851868780027.,Ann Trop Med Parasitol, 2010,PubMed,citation,PMID:21092394,pubmed,21092394,2010/11/26 , A-Elgayoum SM,Khartoum,3,21092394
Pattern of pediatric chronic myeloid leukemia in Sudan and hematological response to imatinib.,/pubmed/21083363,Alkhatib MA.,Pediatr Hematol Oncol. 2011 Mar;28(2):100-5. doi: 10.3109/08880018.2010.512949.,Pediatr Hematol Oncol, 2011,PubMed,citation,PMID:21083363,pubmed,21083363,2010/11/19 , Alkhatib MA,Khartoum,1,21083363
Cancer in the Sudan: an overview of the current status of knowledge on tumor patterns and risk factors.,/pubmed/21071068,"Awadelkarim KD, Mariani-Costantini R, Elwali NE.",Sci Total Environ. 2012 Apr 15;423:214-28. doi: 10.1016/j.scitotenv.2010.09.010. Review.,Sci Total Environ, 2012,PubMed,citation,PMID:21071068,pubmed,21071068,2010/11/13 , Awadelkarim KD,Khartoum,3,21071068
Occupational exposure to staff during endoscopic retrograde cholangiopancreatography in Sudan.,/pubmed/21062799,"Sulieman A, Elzaki M, Khalil M.",Radiat Prot Dosimetry. 2011 Mar;144(1-4):530-3. doi: 10.1093/rpd/ncq353.,Radiat Prot Dosimetry, 2011,PubMed,citation,PMID:21062799,pubmed,21062799,2010/11/11 , Sulieman A,Khartoum,3,21062799
Trends in intra- and inter-annual temperature variabilities across Sudan.,/pubmed/21053725,Elagib NA.,Ambio. 2010 Jul-Sep;39(5-6):413-29.,Ambio, 2010,PubMed,citation,PMID:21053725 | PMCID:PMC3357708,pubmed,21053725,2010/11/09 , Elagib NA,Khartoum,1,21053725 | PMCID:PMC3357708
"Paromomycin for the treatment of visceral leishmaniasis in Sudan: a randomized, open-label, dose-finding study.",/pubmed/21049063,"Musa AM, Younis B, Fadlalla A, Royce C, Balasegaram M, Wasunna M, Hailu A, Edwards T, Omollo R, Mudawi M, Kokwaro G, El-Hassan A, Khalil E.",PLoS Negl Trop Dis. 2010 Oct 26;4(10):e855. doi: 10.1371/journal.pntd.0000855.,PLoS Negl Trop Dis, 2010,PubMed,citation,PMID:21049063 | PMCID:PMC2964291,pubmed,21049063,2010/11/05 , Musa AM,Khartoum,13,21049063 | PMCID:PMC2964291
"Use of antenatal care services in Kassala, eastern Sudan.",/pubmed/20973972,"Ali AA, Osman MM, Abbaker AO, Adam I.",BMC Pregnancy Childbirth. 2010 Oct 25;10:67. doi: 10.1186/1471-2393-10-67.,BMC Pregnancy Childbirth, 2010,PubMed,citation,PMID:20973972 | PMCID:PMC2987884,pubmed,20973972,2010/10/27 , Ali AA,Khartoum,4,20973972 | PMCID:PMC2987884
Cytological study of exfoliative buccal mucosal cells of Qat chewers in Yemen.,/pubmed/20949467,"Ahmed HG, Omer AS, Abd Algaffar SA.",Diagn Cytopathol. 2011 Nov;39(11):796-800. doi: 10.1002/dc.21462.,Diagn Cytopathol, 2011,PubMed,citation,PMID:20949467,pubmed,20949467,2010/10/16 , Ahmed HG,Khartoum,3,20949467
An in vitro comparison of root canal system prepared with either hand or rotary instruments.,/pubmed/24790631,"A Dafalla A, Hassan Abubakr N, E Ibrahim Y.",Iran Endod J. 2010 Fall;5(4):167-73.,Iran Endod J, 2010,PubMed,citation,PMID:24790631 | PMCID:PMC4004794,pubmed,24790631,2010/10/01 , A Dafalla A,Khartoum,3,24790631 | PMCID:PMC4004794
Comparison of artesunate and quinine in the treatment of Sudanese children with severe Plasmodium falciparum malaria.,/pubmed/20850004,"Eltahir HG, Omer AA, Mohamed AA, Adam I.",Trans R Soc Trop Med Hyg. 2010 Oct;104(10):684-6. doi: 10.1016/j.trstmh.2010.05.009.,Trans R Soc Trop Med Hyg, 2010,PubMed,citation,PMID:20850004,pubmed,20850004,2010/09/21 , Eltahir HG,Khartoum,4,20850004
Surrogate markers of subtle renal injury in patients with visceral leishmaniasis.,/pubmed/20814123,"Elnojomi NA, Musa AM, Younis BM, Elfaki ME, El-Hassan AM, Khalil EA.",Saudi J Kidney Dis Transpl. 2010 Sep;21(5):872-5.,Saudi J Kidney Dis Transpl, 2010,PubMed,citation,PMID:20814123,pubmed,20814123,2010/09/04 , Elnojomi NA,Khartoum,6,20814123
First report on Leishmania major/HIV coinfection in a Sudanese patient.,/pubmed/20799602,"Mukhtar MM, Elamin EM, Bakhiet SM, Kheir MM, Ali AB.",East Mediterr Health J. 2010 Jun;16(6):702-3. No abstract available.,East Mediterr Health J, 2010,PubMed,citation,PMID:20799602,pubmed,20799602,2010/08/31 , Mukhtar MM,Khartoum,5,20799602
Caries experience and quantification of Streptococcus mutans and Streptococcus sobrinus in saliva of Sudanese schoolchildren.,/pubmed/20714152,"Nurelhuda NM, Al-Haroni M, Trovik TA, Bakken V.",Caries Res. 2010;44(4):402-7. doi: 10.1159/000316664.,Caries Res, 2010,PubMed,citation,PMID:20714152,pubmed,20714152,2010/08/18 , Nurelhuda NM,Khartoum,4,20714152
An outbreak of peste des petits ruminants (PPR) in camels in the Sudan.,/pubmed/20707980,"Khalafalla AI, Saeed IK, Ali YH, Abdurrahman MB, Kwiatek O, Libeau G, Obeida AA, Abbas Z.",Acta Trop. 2010 Nov;116(2):161-5. doi: 10.1016/j.actatropica.2010.08.002.,Acta Trop, 2010,PubMed,citation,PMID:20707980,pubmed,20707980,2010/08/17 , Khalafalla AI,Khartoum,8,20707980
Colorectal carcinoma associated with schistosomiasis: a possible causal relationship.,/pubmed/20704754,"H Salim OE, Hamid HK, Mekki SO, Suleiman SH, Ibrahim SZ.",World J Surg Oncol. 2010 Aug 13;8:68. doi: 10.1186/1477-7819-8-68. Review.,World J Surg Oncol, 2010,PubMed,citation,PMID:20704754 | PMCID:PMC2928231,pubmed,20704754,2010/08/14 , H Salim OE,Khartoum,5,20704754 | PMCID:PMC2928231
Cyclosporine-A therapy-induced multiple bilateral breast and accessory axillary breast fibroadenomas: a case report.,/pubmed/20701786,"Darwish A, Nasr AO, El Hassan LA, Fahal AH.",J Med Case Rep. 2010 Aug 11;4:267. doi: 10.1186/1752-1947-4-267.,J Med Case Rep, 2010,PubMed,citation,PMID:20701786 | PMCID:PMC2928248,pubmed,20701786,2010/08/13 , Darwish A,Khartoum,4,20701786 | PMCID:PMC2928248
Diagnostic accuracy of the Leishmania OligoC-TesT and NASBA-Oligochromatography for diagnosis of leishmaniasis in Sudan.,/pubmed/20689822,"Saad AA, Ahmed NG, Osman OS, Al-Basheer AA, Hamad A, Deborggraeve S, Büscher P, Schoone GJ, Schallig HD, Laurent T, Haleem A, Osman OF, Eltom AM, Elbashir MI, El-Safi S.",PLoS Negl Trop Dis. 2010 Aug 3;4(8):e776. doi: 10.1371/journal.pntd.0000776.,PLoS Negl Trop Dis, 2010,PubMed,citation,PMID:20689822 | PMCID:PMC2914782,pubmed,20689822,2010/08/07 , Saad AA,Khartoum,15,20689822 | PMCID:PMC2914782
Formulation of wax oxybenzone microparticles using a factorial approach.,/pubmed/20681744,"Gomaa YA, Darwish IA, Boraei NA, El-Khordagui LK.",J Microencapsul. 2010;27(7):628-39. doi: 10.3109/02652048.2010.506580.,J Microencapsul, 2010,PubMed,citation,PMID:20681744,pubmed,20681744,2010/08/05 , Gomaa YA,Khartoum,4,20681744
"Dihydroartemisinin-piperaquine versus artemether-lumefantrine, in the treatment of uncomplicated Plasmodium falciparum malaria in central Sudan.",/pubmed/20659392,"Adam I, Salah MT, Eltahir HG, Elhassan AH, Elmardi KA, Malik EM.",Ann Trop Med Parasitol. 2010 Jun;104(4):319-26. doi: 10.1179/136485910X12743554760144.,Ann Trop Med Parasitol, 2010,PubMed,citation,PMID:20659392,pubmed,20659392,2010/07/28 , Adam I,Khartoum,6,20659392
Bedside teaching at the Cinderella status. Options for promotion.,/pubmed/20635005,Ahmed AM.,Saudi Med J. 2010 Jul;31(7):739-46. Review.,Saudi Med J, 2010,PubMed,citation,PMID:20635005,pubmed,20635005,2010/07/17 , Ahmed AM,Khartoum,1,20635005
Morphometric and molecular differentiation of Phlebotomus (Phlebotomus) sandflies.,/pubmed/20633225,"Khalid N, Elnaiem D, Aboud M, Al Rabba F, Tripet F.",Med Vet Entomol. 2010 Dec;24(4):352-60. doi: 10.1111/j.1365-2915.2010.00893.x.,Med Vet Entomol, 2010,PubMed,citation,PMID:20633225,pubmed,20633225,2010/07/17 , Khalid N,Khartoum,5,20633225
"Maternal and perinatal outcomes of dengue in PortSudan, Eastern Sudan.",/pubmed/20626851,"Adam I, Jumaa AM, Elbashir HM, Karsany MS.",Virol J. 2010 Jul 13;7:153. doi: 10.1186/1743-422X-7-153.,Virol J, 2010,PubMed,citation,PMID:20626851 | PMCID:PMC2911427,pubmed,20626851,2010/07/16 , Adam I,Khartoum,4,20626851 | PMCID:PMC2911427
Pattern of glomerular diseases in Sudanese children: a clinico-pathological study.,/pubmed/20587895,"Abdelraheem MB, Ali el-TM, Mohamed RM, Hassan EG, Abdalla OA, Mekki SO, Yousif BM, Watson AR.",Saudi J Kidney Dis Transpl. 2010 Jul;21(4):778-83.,Saudi J Kidney Dis Transpl, 2010,PubMed,citation,PMID:20587895,pubmed,20587895,2010/07/01 , Abdelraheem MB,Khartoum,8,20587895
Paediatric cardiology programs in countries with limited resources: how to bridge the gap.,/pubmed/23960607,Sulafa KM.,J Saudi Heart Assoc. 2010 Jul;22(3):137-41. doi: 10.1016/j.jsha.2010.04.014.,J Saudi Heart Assoc, 2010,PubMed,citation,PMID:23960607 | PMCID:PMC3727505,pubmed,23960607,2010/07/01 , Sulafa KM,Khartoum,1,23960607 | PMCID:PMC3727505
"Intracellular scavenging activity of Trolox (6-hydroxy-2,5,7,8-tetramethylchromane-2-carboxylic acid) in the fission yeast, Schizosaccharomyces pombe.",/pubmed/22096330,"Hamad I, Arda N, Pekmez M, Karaer S, Temizkan G.",J Nat Sci Biol Med. 2010 Jul;1(1):16-21. doi: 10.4103/0976-9668.71667.,J Nat Sci Biol Med, 2010,PubMed,citation,PMID:22096330 | PMCID:PMC3217288,pubmed,22096330,2010/07/01 , Hamad I,Khartoum,5,22096330 | PMCID:PMC3217288
"Anaemia and low birth weight in Medani, Hospital Sudan.",/pubmed/20584294,"Elhassan EM, Abbaker AO, Haggaz AD, Abubaker MS, Adam I.",BMC Res Notes. 2010 Jun 28;3:181. doi: 10.1186/1756-0500-3-181.,BMC Res Notes, 2010,PubMed,citation,PMID:20584294 | PMCID:PMC2907404,pubmed,20584294,2010/06/30 , Elhassan EM,Khartoum,5,20584294 | PMCID:PMC2907404
Role of jejunostomy feeding catheter as a model for nutritional support.,/pubmed/20538080,"Abdelgadir MA, Mahadi SE, Nasr AO, Ahmed ME.",Int J Surg. 2010;8(6):439-43. doi: 10.1016/j.ijsu.2010.05.006.,Int J Surg, 2010,PubMed,citation,PMID:20538080,pubmed,20538080,2010/06/12 , Abdelgadir MA,Khartoum,4,20538080
Determination of aflatoxin levels in Sudanese edible oils.,/pubmed/20478351,"Idris YM, Mariod AA, Elnour IA, Mohamed AA.",Food Chem Toxicol. 2010 Aug-Sep;48(8-9):2539-41. doi: 10.1016/j.fct.2010.05.021.,Food Chem Toxicol, 2010,PubMed,citation,PMID:20478351,pubmed,20478351,2010/05/19 , Idris YM,Khartoum,4,20478351
"Rift Valley Fever among febrile patients at New Halfa hospital, eastern Sudan.",/pubmed/20465791,"Hassanain AM, Noureldien W, Karsany MS, Saeed el NS, Aradaib IE, Adam I.",Virol J. 2010 May 13;7:97. doi: 10.1186/1743-422X-7-97.,Virol J, 2010,PubMed,citation,PMID:20465791 | PMCID:PMC2877681,pubmed,20465791,2010/05/15 , Hassanain AM,Khartoum,6,20465791 | PMCID:PMC2877681
The treatment of bovine dermatophilosis and its effect on some haematological and blood chemical parameters.,/pubmed/20462170,"Hamid ME, Musa MS.",Rev Sci Tech. 2009 Dec;28(3):1111-8.,Rev Sci Tech, 2009,PubMed,citation,PMID:20462170,pubmed,20462170,2010/05/14 , Hamid ME,Khartoum,2,20462170
Candidate malaria susceptibility/protective SNPs in hospital and population-based studies: the effect of sub-structuring.,/pubmed/20459687,"Eid NA, Hussein AA, Elzein AM, Mohamed HS, Rockett KA, Kwiatkowski DP, Ibrahim ME.",Malar J. 2010 May 8;9:119. doi: 10.1186/1475-2875-9-119.,Malar J, 2010,PubMed,citation,PMID:20459687 | PMCID:PMC2877684,pubmed,20459687,2010/05/13 , Eid NA,Khartoum,7,20459687 | PMCID:PMC2877684
"The influence of temperature and humidity on oviposition and hatchability of Amblyomma lepidum (Dönitz, 1808) (Acarina: Ixodidae) under laboratory conditions.",/pubmed/20434269,"Binni EA, Yagi AI, Mohammed AS.",Vet Parasitol. 2010 Jun 24;170(3-4):344-7. doi: 10.1016/j.vetpar.2010.02.035.,Vet Parasitol, 2010,PubMed,citation,PMID:20434269,pubmed,20434269,2010/05/04 , Binni EA,Khartoum,3,20434269
Bacteriological and parasitological assessment of food handlers in the Omdurman area of Sudan.,/pubmed/20434126,"Saeed HA, Hamid HH.",J Microbiol Immunol Infect. 2010 Feb;43(1):70-3. doi: 10.1016/S1684-1182(10)60010-2.,J Microbiol Immunol Infect, 2010,PubMed,citation,PMID:20434126,pubmed,20434126,2010/05/04 , Saeed HA,Khartoum,2,20434126
"Zinc, parity, infection, and severe anemia among pregnant women in Kassla, eastern Sudan.",/pubmed/20428963,"Mohamed AA, Ali AA, Ali NI, Abusalama EH, Elbashir MI, Adam I.",Biol Trace Elem Res. 2011 Jun;140(3):284-90. doi: 10.1007/s12011-010-8704-3.,Biol Trace Elem Res, 2011,PubMed,citation,PMID:20428963,pubmed,20428963,2010/04/30 , Mohamed AA,Khartoum,6,20428963
"Nosocomial outbreak of Crimean-Congo hemorrhagic fever, Sudan.",/pubmed/20409377,"Aradaib IE, Erickson BR, Mustafa ME, Khristova ML, Saeed NS, Elageb RM, Nichol ST.",Emerg Infect Dis. 2010 May;16(5):837-9. doi: 10.3201/eid1605.091815.,Emerg Infect Dis, 2010,PubMed,citation,PMID:20409377 | PMCID:PMC2954009,pubmed,20409377,2010/04/23 , Aradaib IE,Khartoum,7,20409377 | PMCID:PMC2954009
Maltodextrin: a novel excipient used in sugar-based orally disintegrating tablets and phase transition process.,/pubmed/20405257,"Elnaggar YS, El-Massik MA, Abdallah OY, Ebian AE.",AAPS PharmSciTech. 2010 Jun;11(2):645-51. doi: 10.1208/s12249-010-9423-y.,AAPS PharmSciTech, 2010,PubMed,citation,PMID:20405257 | PMCID:PMC2902317,pubmed,20405257,2010/04/21 , Elnaggar YS,Khartoum,4,20405257 | PMCID:PMC2902317
Towards a noninvasive approach to malaria diagnosis: detection of parasite DNA in body secretions and surface mucosa.,/pubmed/20389119,"A-Elgayoum SM, El-Rayah el-A, Giha HA.",J Mol Microbiol Biotechnol. 2010;18(3):148-55. doi: 10.1159/000308516.,J Mol Microbiol Biotechnol, 2010,PubMed,citation,PMID:20389119,pubmed,20389119,2010/04/15 , A-Elgayoum SM,Khartoum,3,20389119
Frequencies of BCR-ABL1 fusion transcripts among Sudanese chronic myeloid leukaemia patients.,/pubmed/21637474,"Osman EA, Hamad K, Elmula IM, Ibrahim ME.",Genet Mol Biol. 2010 Apr;33(2):229-31. doi: 10.1590/S1415-47572010005000037.,Genet Mol Biol, 2010,PubMed,citation,PMID:21637474 | PMCID:PMC3036862,pubmed,21637474,2010/04/01 , Osman EA,Khartoum,4,21637474 | PMCID:PMC3036862
Applications of capillary electrophoresis with capacitively coupled contactless conductivity detection (CE-C4D) in pharmaceutical and biological analysis.,/pubmed/20352651,"Elbashir AA, Aboul-Enein HY.",Biomed Chromatogr. 2010 Oct;24(10):1038-44. doi: 10.1002/bmc.1417. Review.,Biomed Chromatogr, 2010,PubMed,citation,PMID:20352651,pubmed,20352651,2010/03/31 , Elbashir AA,Khartoum,2,20352651
Leishmania donovani: genetic diversity of isolates from Sudan characterized by PCR-based RAPD.,/pubmed/20346944,"Hamad SH, Khalil EA, Musa AM, Ibrahim ME, Younis BM, Elfaki ME, El-Hassan AM; Leishmaniasis Research Group, Sudan..",Exp Parasitol. 2010 Aug;125(4):389-93. doi: 10.1016/j.exppara.2010.03.008.,Exp Parasitol, 2010,PubMed,citation,PMID:20346944,pubmed,20346944,2010/03/30 , Hamad SH,Khartoum,8,20346944
