Title,URL,Description,Details,Journal,Year,Resource,Type,Identifiers,Db,EntrezUID,cDate,First_Author,University,Author_Number,pmid
Caries and dental fluorosis in a 0.25 and a 2.5 ppm fluoride area in the Sudan.,/pubmed/9482041,"Ibrahim YE, Bjorvatn K, Birkeland JM.",Int J Paediatr Dent. 1997 Sep;7(3):161-6.,Int J Paediatr Dent, 1997,PubMed,citation,PMID:9482041,pubmed,9482041,1998/03/03 , Ibrahim YE,Khartoum,3,9482041
"A comparative study of some drug-metabolizing enzymes in lungs of Dromedary camels, desert sheep and Nubian goats.",/pubmed/9430776,Elsheikh HA.,J Vet Pharmacol Ther. 1997 Dec;20(6):496-8. No abstract available.,J Vet Pharmacol Ther, 1997,PubMed,citation,PMID:9430776,pubmed,9430776,1998/02/07 , Elsheikh HA,Khartoum,1,9430776
Toxicity of Piper abyssinica seeds to Nubian goats.,/pubmed/9451859,"Ali WE, el Badwi SM, Abdel Salam IS, Adam SE.",Dtsch Tierarztl Wochenschr. 1997 Dec;104(12):520-2.,Dtsch Tierarztl Wochenschr, 1997,PubMed,citation,PMID:9451859,pubmed,9451859,1998/02/06 , Ali WE,Khartoum,4,9451859
The effect of water deprivation on the pharmacokinetics of antipyrine and sulphadimidine following intravenous administration in Nubian goats.,/pubmed/9444081,"Elsheikh HA, Osman IA, Abdullah AS.",Vet Res Commun. 1997 Nov;21(8):587-97.,Vet Res Commun, 1997,PubMed,citation,PMID:9444081,pubmed,9444081,1998/01/28 , Elsheikh HA,Khartoum,3,9444081
The 'watering-can' perineum: presentation and management.,/pubmed/9439413,"Sharfi AR, Elarabi YE.",Br J Urol. 1997 Dec;80(6):933-6.,Br J Urol, 1997,PubMed,citation,PMID:9439413,pubmed,9439413,1998/01/24 , Sharfi AR,Khartoum,2,9439413
Occurrence in Sudan of Shigella dysenteriae type 1 with transferable antimicrobial resistance.,/pubmed/9425371,"Musa HA, Hassan HS, Shears P.",Ann Trop Med Parasitol. 1997 Sep;91(6):669-71. No abstract available.,Ann Trop Med Parasitol, 1997,PubMed,citation,PMID:9425371,pubmed,9425371,1998/01/13 , Musa HA,Khartoum,3,9425371
Seasonal variation in the incidence of endoscopically diagnosed duodenal ulcer in Sudan.,/pubmed/19864781,"Kheir MM, Fedail SS, El Kadrou AG.",Saudi J Gastroenterol. 1998 Jan;4(1):17-9.,Saudi J Gastroenterol, 1998,PubMed,citation,PMID:19864781,pubmed,19864781,1998/01/01 , Kheir MM,Khartoum,3,19864781
Decreased erythropoietin response in Plasmodium falciparum malaria-associated anaemia.,/pubmed/9414641,"el Hassan AM, Saeed AM, Fandrey J, Jelkmann W.",Eur J Haematol. 1997 Nov;59(5):299-304.,Eur J Haematol, 1997,PubMed,citation,PMID:9414641,pubmed,9414641,1998/01/01 , el Hassan AM,Khartoum,4,9414641
The effect of praziquantel on the hepatic activities of some drug-metabolizing enzymes in rabbits experimentally infected with Schistosoma bovis.,/pubmed/9350265,"Elsheikh HA, Kheir WM, Abdullah AS.",J Vet Pharmacol Ther. 1997 Oct;20(5):411-4. No abstract available.,J Vet Pharmacol Ther, 1997,PubMed,citation,PMID:9350265,pubmed,9350265,1997/11/14 , Elsheikh HA,Khartoum,3,9350265
Evaluation of PCR for diagnosis of visceral leishmaniasis.,/pubmed/9316888,"Osman OF, Oskam L, Zijlstra EE, Kroon NC, Schoone GJ, Khalil ET, El-Hassan AM, Kager PA.",J Clin Microbiol. 1997 Oct;35(10):2454-7.,J Clin Microbiol, 1997,PubMed,citation,PMID:9316888 | PMCID:PMC229991,pubmed,9316888,1997/10/08 , Osman OF,Khartoum,8,9316888 | PMCID:PMC229991
"Comparative pharmacokinetics of ampicillin trihydrate, gentamicin sulphate and oxytetracycline hydrochloride in Nubian goats and desert sheep.",/pubmed/9280365,"Elsheikh HA, Osman IA, Ali BH.",J Vet Pharmacol Ther. 1997 Aug;20(4):262-6.,J Vet Pharmacol Ther, 1997,PubMed,citation,PMID:9280365,pubmed,9280365,1997/08/01 , Elsheikh HA,Khartoum,3,9280365
Amputation and prostheses in Khartoum.,/pubmed/9276560,"Mohamed IA, Ahmed AR, Ahmed ME.",J R Coll Surg Edinb. 1997 Aug;42(4):248-51.,J R Coll Surg Edinb, 1997,PubMed,citation,PMID:9276560,pubmed,9276560,1997/08/01 , Mohamed IA,Khartoum,3,9276560
Foreign bodies in the tracheobronchial tree in Sudanese patients.,/pubmed/9276556,Yagi HI.,J R Coll Surg Edinb. 1997 Aug;42(4):235-7.,J R Coll Surg Edinb, 1997,PubMed,citation,PMID:9276556,pubmed,9276556,1997/08/01 , Yagi HI,Khartoum,1,9276556
"High incidence of type 1 diabetes mellitus in Sudanese children, 1991-1995.",/pubmed/17353609,"Elamin A, Ghalib M, Eltayeb B, Tuvemo T.",Ann Saudi Med. 1997 Jul;17(4):478-80. No abstract available.,Ann Saudi Med, 1997,PubMed,citation,PMID:17353609,pubmed,17353609,1997/07/01 , Elamin A,Khartoum,4,17353609
Demographic and clinical features of diabetes mellitus in 1095 Yemeni patients.,/pubmed/17353590,"Gunaid AA, El Khally FM, Hassan NA, Mukhtar el D.",Ann Saudi Med. 1997 Jul;17(4):402-9.,Ann Saudi Med, 1997,PubMed,citation,PMID:17353590,pubmed,17353590,1997/07/01 , Gunaid AA,Khartoum,4,17353590
Calculi within an anal fistula tract.,/pubmed/9240147,"Fahal AH, Birido NO, Gadir AF, el Arabi YE.",Br J Surg. 1997 Jul;84(7):1001. No abstract available.,Br J Surg, 1997,PubMed,citation,PMID:9240147,pubmed,9240147,1997/07/01 , Fahal AH,Khartoum,4,9240147
Serogrouping and topotyping of Sudanese and United States strains of epizootic hemorrhagic disease virus using PCR.,/pubmed/9280388,"Aradaib IE, Mohammed ME, Mukhtar MM, Ghalib HW, Osburn BI.",Comp Immunol Microbiol Infect Dis. 1997 Jun;20(3):211-8.,Comp Immunol Microbiol Infect Dis, 1997,PubMed,citation,PMID:9280388,pubmed,9280388,1997/06/01 , Aradaib IE,Khartoum,5,9280388
The effect of experimental fascioliasis on the pharmacokinetics of antipyrine and sulphadimidine in desert sheep.,/pubmed/9185081,"Elsheikh HA, Ali BH.",J Vet Pharmacol Ther. 1997 Jun;20(3):167-72.,J Vet Pharmacol Ther, 1997,PubMed,citation,PMID:9185081,pubmed,9185081,1997/06/01 , Elsheikh HA,Khartoum,2,9185081
"Effects of early disease on later growth, and early growth on later disease, in Khartoum infants.",/pubmed/9158838,"Brush G, Harrison GA, Waterlow JC.",Ann Hum Biol. 1997 May-Jun;24(3):187-95.,Ann Hum Biol, 1997,PubMed,citation,PMID:9158838,pubmed,9158838,1997/05/01 , Brush G,Khartoum,3,9158838
Phlebotomine sandflies in a focus of visceral leishmaniasis in a border area of eastern Sudan.,/pubmed/9229023,"Elnaiem DA, Hassan HK, Ward RD.",Ann Trop Med Parasitol. 1997 Apr;91(3):307-18.,Ann Trop Med Parasitol, 1997,PubMed,citation,PMID:9229023,pubmed,9229023,1997/04/01 , Elnaiem DA,Khartoum,3,9229023
Iodine nutrition in Sudan: determination of thyroid-stimulating hormone in filter paper blood samples.,/pubmed/9200277,"Elnagar B, Gebre-Medhin M, Larsson A, Karlsson FA.",Scand J Clin Lab Invest. 1997 Apr;57(2):175-81.,Scand J Clin Lab Invest, 1997,PubMed,citation,PMID:9200277,pubmed,9200277,1997/04/01 , Elnagar B,Khartoum,4,9200277
Focal heat stimulation for the determination of the minimum alveolar concentration of halothane in the rabbit.,/pubmed/9090043,"Sobair AT, Cottrell DF, Camburn MA.",Vet Res Commun. 1997 Apr;21(3):149-59.,Vet Res Commun, 1997,PubMed,citation,PMID:9090043,pubmed,9090043,1997/04/01 , Sobair AT,Khartoum,3,9090043
Tuberculosis and myelofibrosis in children: a report.,/pubmed/9176580,"Hashim MS, Kordofani AY, el Dabi MA.",Ann Trop Paediatr. 1997 Mar;17(1):61-5.,Ann Trop Paediatr, 1997,PubMed,citation,PMID:9176580,pubmed,9176580,1997/03/01 , Hashim MS,Khartoum,3,9176580
Blood supply and vasculature of mycetoma.,/pubmed/9147269,"Fahal AH, el Hag IA, Gadir AF, el Lider AR, el Hassan AM, Baraka OZ, Mahgoub ES.",J Med Vet Mycol. 1997 Mar-Apr;35(2):101-6.,J Med Vet Mycol, 1997,PubMed,citation,PMID:9147269,pubmed,9147269,1997/03/01 , Fahal AH,Khartoum,7,9147269
Effect of cooking on cowpea protein fractions.,/pubmed/9629867,"Nugdallah GA, El Tinay AH.",Plant Foods Hum Nutr. 1997;51(3):277-82.,Plant Foods Hum Nutr, 1997,PubMed,citation,PMID:9629867,pubmed,9629867,1997/01/01 , Nugdallah GA,Khartoum,2,9629867
Motor neurone disease in the tropics: findings from Sudan.,/pubmed/9145578,"Abdulla MN, Sokrab TE, el Tahir A, Siddig HE, Ali ME.",East Afr Med J. 1997 Jan;74(1):46-8.,East Afr Med J, 1997,PubMed,citation,PMID:9145578,pubmed,9145578,1997/01/01 , Abdulla MN,Khartoum,5,9145578
Oronasal leishmaniasis caused by a parasite with an unusual isoenzyme profile.,/pubmed/9063369,"Ibrahim M, Suliman A, Hashim FA, Khalil el-T A, Evans DA, Kharazmi A, el Hassan AM.",Am J Trop Med Hyg. 1997 Jan;56(1):96-8.,Am J Trop Med Hyg, 1997,PubMed,citation,PMID:9063369,pubmed,9063369,1997/01/01 , Ibrahim M,Khartoum,7,9063369
Intraspinal mycetoma: report of two cases.,/pubmed/9063356,"Arbab MA, el Hag IA, Abdul Gadir AF, Siddik H el-R.",Am J Trop Med Hyg. 1997 Jan;56(1):27-9.,Am J Trop Med Hyg, 1997,PubMed,citation,PMID:9063356,pubmed,9063356,1997/01/01 , Arbab MA,Khartoum,4,9063356
The Marrara syndrome: a hypersensitivity reaction of the upper respiratory tract and buccopharyngeal mucosa to nymphs of Linguatula serrata.,/pubmed/9025980,"Yagi H, el Bahari S, Mohamed HA, Ahmed el-R S, Mustafa B, Mahmoud M, Saad MB, Sulaiman SM, el Hassan AM.",Acta Trop. 1996 Dec 16;62(3):127-34.,Acta Trop, 1996,PubMed,citation,PMID:9025980,pubmed,9025980,1996/12/16 , Yagi H,Khartoum,9,9025980
Mycetoma-induced palatal deficiency and pharyngeal plexus dysfunction.,/pubmed/9015514,"Fahal AH, Yagi HI, el Hassan AM.",Trans R Soc Trop Med Hyg. 1996 Nov-Dec;90(6):676-7. No abstract available.,Trans R Soc Trop Med Hyg, 1996,PubMed,citation,PMID:9015514,pubmed,9015514,1996/11/01 , Fahal AH,Khartoum,3,9015514
Pathological fracture in mycetoma.,/pubmed/9015513,"Fahal AH, Sheikh HE, el Hassan AM.",Trans R Soc Trop Med Hyg. 1996 Nov-Dec;90(6):675-6. No abstract available.,Trans R Soc Trop Med Hyg, 1996,PubMed,citation,PMID:9015513,pubmed,9015513,1996/11/01 , Fahal AH,Khartoum,3,9015513
Prevalence of HBsAg among the non cauterized groups of blood donors.,/pubmed/8997860,"Khalil IA, Elsheikh FS, Phrykian J, Phrykian S, Mitchell R.",East Afr Med J. 1996 Nov;73(11):717-9.,East Afr Med J, 1996,PubMed,citation,PMID:8997860,pubmed,8997860,1996/11/01 , Khalil IA,Khartoum,5,8997860
Solitary thyroid nodule in Khartoum.,/pubmed/8997854,"Bashier AH, Abdin I, Elhassan M, Sanhouri M, Ahmed ME.",East Afr Med J. 1996 Oct;73(10):694-6.,East Afr Med J, 1996,PubMed,citation,PMID:8997854,pubmed,8997854,1996/10/01 , Bashier AH,Khartoum,5,8997854
Application of molecular biological techniques for detection of epizootic hemorrhagic disease virus (EHDV-318) recovered from a sentinel calf in central Sudan.,/pubmed/8972046,"Mohammed ME, Aradaib IE, Mukhtar MM, Ghalib HW, Riemann HP, Oyejide A, Osburn BI.",Vet Microbiol. 1996 Oct;52(3-4):201-8.,Vet Microbiol, 1996,PubMed,citation,PMID:8972046,pubmed,8972046,1996/10/01 , Mohammed ME,Khartoum,7,8972046
The pathology of cutaneous leishmaniasis in the Sudan: a comparison with that in other geographical areas.,/pubmed/8915124,"el Hassan AM, Kadaru AM, Khalil EA, Fadl A, el Hassan MM.",Ann Trop Med Parasitol. 1996 Oct;90(5):485-90.,Ann Trop Med Parasitol, 1996,PubMed,citation,PMID:8915124,pubmed,8915124,1996/10/01 , el Hassan AM,Khartoum,5,8915124
Internal fistula formation: an unusual complication of mycetoma.,/pubmed/8944271,"Fahal AH, Sharfi AR, Sheik HE, el Hassan AM, Mahgoub ES.",Trans R Soc Trop Med Hyg. 1996 Sep-Oct;90(5):550-2.,Trans R Soc Trop Med Hyg, 1996,PubMed,citation,PMID:8944271,pubmed,8944271,1996/09/01 , Fahal AH,Khartoum,5,8944271
Post-endemic acute bacterial meningitis in Sudanese children.,/pubmed/8898469,"Ahmed AA, Salih MA, Ahmed HS.",East Afr Med J. 1996 Aug;73(8):527-32.,East Afr Med J, 1996,PubMed,citation,PMID:8898469,pubmed,8898469,1996/08/01 , Ahmed AA,Khartoum,3,8898469
Paraphenylenediamine induced optic atrophy following hair dye poisoning.,/pubmed/8863054,"Yagi H, el Hendi AM, Diab A, Elshikh AA.",Hum Exp Toxicol. 1996 Aug;15(8):617-8. No abstract available.,Hum Exp Toxicol, 1996,PubMed,citation,PMID:8863054,pubmed,8863054,1996/08/01 , Yagi H,Khartoum,4,8863054
Mastitis in Camelus dromedarius and the somatic cell content of camels' milk.,/pubmed/8819195,"Obied AI, Bagadi HO, Mukhtar MM.",Res Vet Sci. 1996 Jul;61(1):55-8.,Res Vet Sci, 1996,PubMed,citation,PMID:8819195,pubmed,8819195,1996/07/01 , Obied AI,Khartoum,3,8819195
New antimicrobial rhodanines.,/pubmed/8767855,"Makhlouf AM, Mohamed AS.",Pharmazie. 1996 Jun;51(6):430-1. No abstract available.,Pharmazie, 1996,PubMed,citation,PMID:8767855,pubmed,8767855,1996/06/01 , Makhlouf AM,Khartoum,2,8767855
Neutrophil leucocyte activation in severe malaria.,/pubmed/8758075,"Mohamed AO, Elbashir MI, Ibrahim G, Ismail M, Venge P.",Trans R Soc Trop Med Hyg. 1996 May-Jun;90(3):277. No abstract available.,Trans R Soc Trop Med Hyg, 1996,PubMed,citation,PMID:8758075,pubmed,8758075,1996/05/01 , Mohamed AO,Khartoum,5,8758075
Title,URL,Description,Details,ShortDetails,NA,Resource,Type,Identifiers,Db,EntrezUID,Properties,NA,Khartoum,1,Identifiers
Intestinal obstruction in Khartoum.,/pubmed/8756035,"Sourkati EO, Fahal AH, Suliman SH, el Razig SA, Arabi YE.",East Afr Med J. 1996 May;73(5):316-9.,East Afr Med J, 1996,PubMed,citation,PMID:8756035,pubmed,8756035,1996/05/01 , Sourkati EO,Khartoum,5,8756035
Fine needle aspiration cytology of mycetoma.,/pubmed/8669179,"EL Hag IA, Fahal AH, Gasim ET.",Acta Cytol. 1996 May-Jun;40(3):461-4.,Acta Cytol, 1996,PubMed,citation,PMID:8669179,pubmed,8669179,1996/05/01 , EL Hag IA,Khartoum,3,8669179
Ossification of the penis: report of two cases.,/pubmed/8706616,"Fahal AH, Gadir AF, Nasr IO.",East Afr Med J. 1996 Apr;73(4):276-7.,East Afr Med J, 1996,PubMed,citation,PMID:8706616,pubmed,8706616,1996/04/01 , Fahal AH,Khartoum,3,8706616
"Failure of a combination of two antifungal drugs, terbinafine plus itraconazole, in Sudanese post kala-azar dermal leishmaniasis.",/pubmed/8761586,"Khalil EA, Nur NM, Zijlstra EE, El-Hassan AM, Davidson RN.",Trans R Soc Trop Med Hyg. 1996 Mar-Apr;90(2):187-8. No abstract available.,Trans R Soc Trop Med Hyg, 1996,PubMed,citation,PMID:8761586,pubmed,8761586,1996/03/01 , Khalil EA,Khartoum,5,8761586
"Changes in sugar, ash and minerals in four guava cultivars during ripening.",/pubmed/8811728,"el Buluk RE, Babiker FE, el Tinay AH.",Plant Foods Hum Nutr. 1996 Feb;49(2):147-54.,Plant Foods Hum Nutr, 1996,PubMed,citation,PMID:8811728,pubmed,8811728,1996/02/01 , el Buluk RE,Khartoum,3,8811728
Akabane virus: serological survey of antibodies in livestock in the Sudan.,/pubmed/9239934,"Mohamed ME, Mellor PS, Taylor WP.",Rev Elev Med Vet Pays Trop. 1996;49(4):285-8.,Rev Elev Med Vet Pays Trop, 1996,PubMed,citation,PMID:9239934,pubmed,9239934,1996/01/01 , Mohamed ME,Khartoum,3,9239934
Ivermectin distribution in the plasma and tissues of patients infected with Onchocerca volvulus.,/pubmed/8839664,"Baraka OZ, Mahmoud BM, Marschke CK, Geary TG, Homeida MM, Williams JF.",Eur J Clin Pharmacol. 1996;50(5):407-10.,Eur J Clin Pharmacol, 1996,PubMed,citation,PMID:8839664,pubmed,8839664,1996/01/01 , Baraka OZ,Khartoum,6,8839664
Pattern of postoperative pyrexia in Khartoum.,/pubmed/8625871,"Fadl Alla AI, Fahal AH, Ahmed ME, Hassan MA.",East Afr Med J. 1996 Jan;73(1):78-80.,East Afr Med J, 1996,PubMed,citation,PMID:8625871,pubmed,8625871,1996/01/01 , Fadl Alla AI,Khartoum,4,8625871
Prevalence of dental fluorosis in Sudanese children from two villages with 0.25 and 2.56 ppm fluoride in the drinking water.,/pubmed/8957835,"Ibrahim YE, Affan AA, Bjorvatn K.",Int J Paediatr Dent. 1995 Dec;5(4):223-9.,Int J Paediatr Dent, 1995,PubMed,citation,PMID:8957835,pubmed,8957835,1995/12/01 , Ibrahim YE,Khartoum,3,8957835
Cereal-based oral rehydration solutions in Sudanese children with diarrhoea: a comparative clinical trial of rice-based and sorghum-based oral rehydration solutions.,/pubmed/8687209,"Mustafa SA, Karrar ZE, Suliman JI.",Ann Trop Paediatr. 1995 Dec;15(4):313-9.,Ann Trop Paediatr, 1995,PubMed,citation,PMID:8687209,pubmed,8687209,1995/12/01 , Mustafa SA,Khartoum,3,8687209
An ELISA assay for the rapid diagnosis of acute bacterial meningitis.,/pubmed/8687201,"Salih MA, Ahmed AA, Sid Ahmed H, Olcen P.",Ann Trop Paediatr. 1995 Dec;15(4):273-8.,Ann Trop Paediatr, 1995,PubMed,citation,PMID:8687201,pubmed,8687201,1995/12/01 , Salih MA,Khartoum,4,8687201
Response of Bovans chicks to low dietary levels of Linum usitatissimum seeds.,/pubmed/8588289,"Bakhiet AO, Adam SE.",Vet Hum Toxicol. 1995 Dec;37(6):534-6.,Vet Hum Toxicol, 1995,PubMed,citation,PMID:8588289,pubmed,8588289,1995/12/01 , Bakhiet AO,Khartoum,2,8588289
Toombak dipping and cancer of the oral cavity in the Sudan: a case-control study.,/pubmed/7591252,"Idris AM, Ahmed HM, Malik MO.",Int J Cancer. 1995 Nov 15;63(4):477-80.,Int J Cancer, 1995,PubMed,citation,PMID:7591252,pubmed,7591252,1995/11/15 , Idris AM,Khartoum,3,7591252
Dual infection with mycetoma and tuberculosis: report of two cases.,/pubmed/8904072,"Fahal AH, Azziz KA, Saliman SH, Galib HV, Mahgoub S.",East Afr Med J. 1995 Nov;72(11):749-50.,East Afr Med J, 1995,PubMed,citation,PMID:8904072,pubmed,8904072,1995/11/01 , Fahal AH,Khartoum,5,8904072
"Sudanese mucosal leishmaniasis: epidemiology, clinical features, diagnosis, immune responses and treatment.",/pubmed/8594683,"el-Hassan AM, Meredith SE, Yagi HI, Khalil EA, Ghalib HW, Abbas K, Zijlstra EE, Kroon CC, Schoone GJ, Ismail A.",Trans R Soc Trop Med Hyg. 1995 Nov-Dec;89(6):647-52.,Trans R Soc Trop Med Hyg, 1995,PubMed,citation,PMID:8594683,pubmed,8594683,1995/11/01 , el-Hassan AM,Khartoum,10,8594683
Aspiration sclerotherapy for hydroceles in the tropics.,/pubmed/7551889,"Musa MT, Fahal AH, el Arabi YE.",Br J Urol. 1995 Oct;76(4):488-90.,Br J Urol, 1995,PubMed,citation,PMID:7551889,pubmed,7551889,1995/10/01 , Musa MT,Khartoum,3,7551889
Rapid growth and increased biomass yield of Mycobacterium farcinogenes and some related taxa in broth and agar media.,/pubmed/8594852,"Hamid ME, Goodfellow M.",Zentralbl Veterinarmed B. 1995 Sep;42(7):397-404.,Zentralbl Veterinarmed B, 1995,PubMed,citation,PMID:8594852,pubmed,8594852,1995/09/01 , Hamid ME,Khartoum,2,8594852
Acarboxy prothrombin (PIVKA II) as a tumour marker for hepatocellular carcinoma and other liver diseases.,/pubmed/7498046,"Mohamedein A, Yousif-Kadaru AG, Ahmed SA, Saida H, Zaki ZA, Eldin, Fedail SS.",East Afr Med J. 1995 Sep;72(9):584-7.,East Afr Med J, 1995,PubMed,citation,PMID:7498046,pubmed,7498046,1995/09/01 , Mohamedein A,Khartoum,7,7498046
An estimation of Citrullus colocynthis toxicity for chicks.,/pubmed/8540228,"Bakhiet AO, Adam SE.",Vet Hum Toxicol. 1995 Aug;37(4):356-8.,Vet Hum Toxicol, 1995,PubMed,citation,PMID:8540228,pubmed,8540228,1995/08/01 , Bakhiet AO,Khartoum,2,8540228
Apparently successful treatment of two cases of post kala-azar dermal leishmaniasis with liposomal amphotericin B.,/pubmed/7570893,"Hashim FA, Khalil EA, Ismail A, el Hassan AM.",Trans R Soc Trop Med Hyg. 1995 Jul-Aug;89(4):440. No abstract available.,Trans R Soc Trop Med Hyg, 1995,PubMed,citation,PMID:7570893,pubmed,7570893,1995/07/01 , Hashim FA,Khartoum,4,7570893
Thyroid function in patients with mycetoma.,/pubmed/7498029,"Fahal AH, Omer SM, el Razig SA, Ali AB, Mahdi EM, Mahgoub ES.",East Afr Med J. 1995 Jul;72(7):454-6.,East Afr Med J, 1995,PubMed,citation,PMID:7498029,pubmed,7498029,1995/07/01 , Fahal AH,Khartoum,6,7498029
Gastrointestinal tract cancer in association with hepatitis and HIV infection.,/pubmed/7498023,"Fahal AH, el Razig SA, Suliman SH, Ibrahim SZ, Tigani AE.",East Afr Med J. 1995 Jul;72(7):424-6.,East Afr Med J, 1995,PubMed,citation,PMID:7498023,pubmed,7498023,1995/07/01 , Fahal AH,Khartoum,5,7498023
"Therapeutic utility, constituents and toxicity of some medicinal plants: a review.",/pubmed/7571361,"Bakhiet AO, Adam SE.",Vet Hum Toxicol. 1995 Jun;37(3):255-8. Review.,Vet Hum Toxicol, 1995,PubMed,citation,PMID:7571361,pubmed,7571361,1995/06/01 , Bakhiet AO,Khartoum,2,7571361
IL-12 enhances Th1-type responses in human Leishmania donovani infections.,/pubmed/7722314,"Ghalib HW, Whittle JA, Kubin M, Hashim FA, el-Hassan AM, Grabstein KH, Trinchieri G, Reed SG.",J Immunol. 1995 May 1;154(9):4623-9.,J Immunol, 1995,PubMed,citation,PMID:7722314,pubmed,7722314,1995/05/01 , Ghalib HW,Khartoum,8,7722314
Community based distribution of ivermectin in eastern Sudan: acceptability and early post-treatment reactions.,/pubmed/7660448,"Baraka OZ, Khier MM, Ahmed KM, Ali MM, el Mardi AE, Mahmoud BM, Ali MH, Homeida MM, Williams JF.",Trans R Soc Trop Med Hyg. 1995 May-Jun;89(3):316-8.,Trans R Soc Trop Med Hyg, 1995,PubMed,citation,PMID:7660448,pubmed,7660448,1995/05/01 , Baraka OZ,Khartoum,9,7660448
Ivermectin treatment in severe asymmetric reactive onchodermatitis (sowda) in Sudan.,/pubmed/7660447,"Baraka OZ, Mahmoud BM, Ali MM, Ali MH, el Sheikh EA, Homeida MM, Mackenzie CD, Williams JF.",Trans R Soc Trop Med Hyg. 1995 May-Jun;89(3):312-5.,Trans R Soc Trop Med Hyg, 1995,PubMed,citation,PMID:7660447,pubmed,7660447,1995/05/01 , Baraka OZ,Khartoum,8,7660447
Leishmanial cholecystitis and colitis in a patient with visceral leishmaniasis.,/pubmed/7660434,"Fahal AH, el Hag IA, el Hassan AM, Hashim FA.",Trans R Soc Trop Med Hyg. 1995 May-Jun;89(3):284. No abstract available.,Trans R Soc Trop Med Hyg, 1995,PubMed,citation,PMID:7660434,pubmed,7660434,1995/05/01 , Fahal AH,Khartoum,4,7660434
"HIV-1 infection in Juba, southern Sudan.",/pubmed/7623001,"McCarthy MC, Khalid IO, El Tigani A.",J Med Virol. 1995 May;46(1):18-20.,J Med Virol, 1995,PubMed,citation,PMID:7623001,pubmed,7623001,1995/05/01 , McCarthy MC,Khartoum,3,7623001
Descriptive epidemiology of oral neoplasms in Sudan 1970-1985 and the role of toombak.,/pubmed/7705940,"Idris AM, Ahmed HM, Mukhtar BI, Gadir AF, el-Beshir EI.",Int J Cancer. 1995 Apr 10;61(2):155-8.,Int J Cancer, 1995,PubMed,citation,PMID:7705940,pubmed,7705940,1995/04/10 , Idris AM,Khartoum,5,7705940
"Effects of endosulfan and amitraz on feedlot performance, carcass yield and meat quality characteristics of Nubian goats.",/pubmed/7631489,"Amin AE, Abdalla GA.",Vet Hum Toxicol. 1995 Apr;37(2):113-6.,Vet Hum Toxicol, 1995,PubMed,citation,PMID:7631489,pubmed,7631489,1995/04/01 , Amin AE,Khartoum,2,7631489
Antigen-presenting cells in human cutaneous leishmaniasis due to Leishmania major.,/pubmed/7882568,"ElHassan AM, Gaafar A, Theander TG.",Clin Exp Immunol. 1995 Mar;99(3):445-53.,Clin Exp Immunol, 1995,PubMed,citation,PMID:7882568 | PMCID:PMC1534205,pubmed,7882568,1995/03/01 , ElHassan AM,Khartoum,3,7882568 | PMCID:PMC1534205
Neurologic changes in visceral leishmaniasis.,/pubmed/7872442,"Hashim FA, Ahmed AE, el Hassan M, el Mubarak MH, Yagi H, Ibrahim EN, Ali MS.",Am J Trop Med Hyg. 1995 Feb;52(2):149-54.,Am J Trop Med Hyg, 1995,PubMed,citation,PMID:7872442,pubmed,7872442,1995/02/01 , Hashim FA,Khartoum,7,7872442
Prevalence and risk factors of parasitic infections among under-five Sudanese children: a community based study.,/pubmed/7796747,"Karrar ZA, Rahim FA.",East Afr Med J. 1995 Feb;72(2):103-9.,East Afr Med J, 1995,PubMed,citation,PMID:7796747,pubmed,7796747,1995/02/01 , Karrar ZA,Khartoum,2,7796747
Prolonged breastfeeding without the introduction of supplementary feeding.,/pubmed/7723126,"Abdel Sayed ZT, Latham MC, Roe DA.",J Trop Pediatr. 1995 Feb;41(1):29-33.,J Trop Pediatr, 1995,PubMed,citation,PMID:7723126,pubmed,7723126,1995/02/01 , Abdel Sayed ZT,Khartoum,3,7723126
The effect of praziquantel on the activities of some drug-metabolizing hepatic enzymes in rabbits.,/pubmed/7600944,"Kheir WM, Elsheikh HA, Hapke HJ.",Dtsch Tierarztl Wochenschr. 1995 Feb;102(2):84-6.,Dtsch Tierarztl Wochenschr, 1995,PubMed,citation,PMID:7600944,pubmed,7600944,1995/02/01 , Kheir WM,Khartoum,3,7600944
Comparative toxicity of Ricinus communis and Jatropha curcas in Brown Hisex chicks.,/pubmed/7600941,"el Badwi SM, Adam SE, Hapke HJ.",Dtsch Tierarztl Wochenschr. 1995 Feb;102(2):75-7.,Dtsch Tierarztl Wochenschr, 1995,PubMed,citation,PMID:7600941,pubmed,7600941,1995/02/01 , el Badwi SM,Khartoum,3,7600941
Recent observations on the epidemiology of kala-azar in the eastern and central states of the Sudan.,/pubmed/8560585,"el-Hassan AM, Zijlstra EE, Ismael A, Ghalib HW.",Trop Geogr Med. 1995;47(4):151-6.,Trop Geogr Med, 1995,PubMed,citation,PMID:8560585,pubmed,8560585,1995/01/01 , el-Hassan AM,Khartoum,4,8560585
The host tissue reaction to Madurella mycetomatis: new classification.,/pubmed/7650573,"Fahal AH, el Toum EA, el Hassan AM, Mahgoub ES, Gumaa SA.",J Med Vet Mycol. 1995 Jan-Feb;33(1):15-7.,J Med Vet Mycol, 1995,PubMed,citation,PMID:7650573,pubmed,7650573,1995/01/01 , Fahal AH,Khartoum,5,7650573
Nutritional vitamin D deficiency rickets in Sudanese children.,/pubmed/7598440,"el Hag AI, Karrar ZA.",Ann Trop Paediatr. 1995;15(1):69-76.,Ann Trop Paediatr, 1995,PubMed,citation,PMID:7598440,pubmed,7598440,1995/01/01 , el Hag AI,Khartoum,2,7598440
"Cryptosporidium in Khartoum, Sudan.",/pubmed/7859660,"Adam AA, Hassan HS, Shears P, Elshibly E.",East Afr Med J. 1994 Nov;71(11):745-6.,East Afr Med J, 1994,PubMed,citation,PMID:7859660,pubmed,7859660,1994/11/01 , Adam AA,Khartoum,4,7859660
Toombak: a major risk factor for cancer of the oral cavity in Sudan.,/pubmed/7855117,"Idris AM, Prokopczyk B, Hoffmann D.",Prev Med. 1994 Nov;23(6):832-9.,Prev Med, 1994,PubMed,citation,PMID:7855117,pubmed,7855117,1994/11/01 , Idris AM,Khartoum,3,7855117
Nigerians divided on AIDS prevalence. International / case rates.,/pubmed/12288417,[No authors listed],AIDS Wkly. 1994 Oct 10:12-3.,AIDS Wkly, 1994,PubMed,citation,PMID:12288417,pubmed,12288417,1994/10/10,NA,Khartoum,1,12288417
Pharmacokinetic interaction between praziquantel and albendazole in Sudanese men.,/pubmed/7979646,"Homeida M, Leahy W, Copeland S, Ali MM, Harron DW.",Ann Trop Med Parasitol. 1994 Oct;88(5):551-9.,Ann Trop Med Parasitol, 1994,PubMed,citation,PMID:7979646,pubmed,7979646,1994/10/01 , Homeida M,Khartoum,5,7979646
Propranolol reduces mortality in patients with portal hypertension secondary to schistosomiasis.,/pubmed/7979639,"el Tourabi H, el Amin AA, Shaheen M, Woda SA, Homeida M, Harron DW.",Ann Trop Med Parasitol. 1994 Oct;88(5):493-500.,Ann Trop Med Parasitol, 1994,PubMed,citation,PMID:7979639,pubmed,7979639,1994/10/01 , el Tourabi H,Khartoum,6,7979639
